{"holo":"blake3:8408e0895572fab09e783f7aadb129dc4cb96d0b62850a16f3ddbe44ed6021ba","level":"P0","passed":true,"policy":{"minimum":"P0","name":"p0"},"reasons":[{"check":"provenance.statement","message":"The holo carries no provenance statement; format revision 2026-10-23 has no attestation bundle (issues #267 and #268).","withholds":"P1"},{"check":"proof.statement","message":"The holo carries no proof statement (issue #266).","withholds":"P2"},{"check":"replay.statement","message":"The holo carries no replay statement (issue #284).","withholds":"P3"}],"schema":"prism/verdict/1"}
