{"holo":"blake3:da01773429edc94b065a583492cf3f5df43e1816b445f72bf840e8865311026e","level":"P0","passed":false,"policy":{"minimum":"P2","name":"default"},"reasons":[{"check":"provenance.envelope","message":"The signature was not checked: name the signer with a key or a certificate identity and issuer (check --key, --certificate-identity and --certificate-oidc-issuer), and an unchecked signature is no evidence.","withholds":"P1"},{"check":"proof.envelope","code":"PP5501","message":"The signature was not checked: name the signer with a key or a certificate identity and issuer (check --key, --certificate-identity and --certificate-oidc-issuer), and an unchecked signature is no evidence.","withholds":"P2"},{"check":"replay.statement","message":"The holo carries no replay statement (issue #284).","withholds":"P3"},{"check":"policy.level","code":"PP5601","message":"The level is P0; the policy requires P2 or above.","withholds":null}],"schema":"prism/verdict/1"}
