{"holo":"blake3:3679659faf138f35de6f04f23312c68d911e0a1e13624b59d9045c57213b3034","level":"P0","passed":false,"policy":{"minimum":"P2","name":"default"},"reasons":[{"check":"provenance.statement","message":"The holo carries no provenance statement; format revision 2026-10-23 has no attestation bundle (issues #267 and #268).","withholds":"P1"},{"check":"proof.statement","message":"The holo carries no proof statement (issue #266).","withholds":"P2"},{"check":"replay.statement","message":"The holo carries no replay statement (issue #284).","withholds":"P3"},{"check":"policy.level","code":"PP5601","message":"The level is P0; the policy requires P2 or above.","withholds":null}],"schema":"prism/verdict/1"}
