{"holo":"blake3:2e9fd44aca775de0dd389c4e743e3c3a976b01d6d85f2d0238adaaa3ac2704af","level":"P1","passed":false,"policy":{"minimum":"P2","name":"default"},"reasons":[{"check":"proof.subject","code":"PP5503","message":"The proof statement is about core-wasm/prism_calculator_core_wasm.wasm with blake3 2adca3e7ca42d7415a5227a20002baad90047d087249cbb9ea36e557f5a4a380, which is not this holo's guest (blake3 0b5bbdb716fa46ca83096e030bb3e18207b2bc4bc53759584e2c9fe9b4cbf4a9).","withholds":"P2"},{"check":"proof.model","code":"PP5504","message":"The proof is about another model: the model document digests are not those of the model blob; model.document.sha256 is not the extension's model_id; model.sourceId is not the extension's source_id; model.semanticId is not the extension's semantic_id; model.snapshotId is not the extension's snapshot_id; model.compilerSemanticsId is not the extension's compiler_semantics_id; model.leanManifestSha256 is not the extension's lean_manifest_sha256.","withholds":"P2"},{"check":"replay.statement","message":"The holo carries no replay statement (issue #284).","withholds":"P3"},{"check":"policy.level","code":"PP5601","message":"The level is P1; the policy requires P2 or above.","withholds":null}],"schema":"prism/verdict/1"}
