{"holo":"blake3:c93680dd36a7c2e2ce343961d73c4b41ae50dbadb4ff005c5ab1b7729c043418","level":"P0","passed":false,"policy":{"minimum":"P2","name":"default"},"reasons":[{"check":"holo.integrity","message":"The footer 8408e0895572fab09e783f7aadb129dc4cb96d0b62850a16f3ddbe44ed6021ba does not equal the BLAKE3 of the body, c93680dd36a7c2e2ce343961d73c4b41ae50dbadb4ff005c5ab1b7729c043418: the archive was altered.","withholds":"P1"},{"check":"holo.integrity","message":"Section 4 is labelled blake3:2adca3e7ca42d7415a5227a20002baad90047d087249cbb9ea36e557f5a4a380 but its content hashes to blake3:78b08b6429c58a71e4f3c990a185909a8424ef6c61d2af176bf11941b1684df9.","withholds":"P1"},{"check":"provenance.statement","message":"The holo carries no provenance statement; format revision 2026-10-23 has no attestation bundle (issues #267 and #268).","withholds":"P1"},{"check":"proof.statement","message":"The holo carries no proof statement (issue #266).","withholds":"P2"},{"check":"replay.statement","message":"The holo carries no replay statement (issue #284).","withholds":"P3"},{"check":"policy.level","code":"PP5601","message":"The level is P0; the policy requires P2 or above.","withholds":null}],"schema":"prism/verdict/1"}
